{
  "$schema": "https://json-schema.org/draft/2020-12/schema",
  "$id": "https://qsolkcb.github.io/AI-CONTEXT/spec/bundle.schema.json",
  "title": "AI-CONTEXT Task Bundle",
  "type": "object",
  "required": [
    "type",
    "protocol",
    "schema_version",
    "canonicalizer",
    "profile",
    "selector_tags",
    "canonical_store_sha256",
    "records",
    "canonical_payload_sha256"
  ],
  "properties": {
    "type": {"const": "ai-context-bundle"},
    "protocol": {"const": "AI-CONTEXT/BUNDLE"},
    "schema_version": {"const": "0.1.0"},
    "canonicalizer": {"const": "python-json-v0.1"},
    "profile": {"type": "string", "minLength": 1},
    "selector_tags": {"type": "array", "items": {"type": "string"}, "uniqueItems": true},
    "canonical_store_sha256": {"type": "string", "pattern": "^[0-9a-f]{64}$"},
    "records": {
      "type": "array",
      "items": {"$ref": "memory-record.schema.json"}
    },
    "canonical_payload_sha256": {"type": "string", "pattern": "^[0-9a-f]{64}$"}
  },
  "additionalProperties": false
}
